{
  "$schema": "./schemas/approvals.schema.json",
  "people": [
    {
      "personId": "karan-mittal",
      "recordHash": "79f0dcb5fe49c2545291d1ab0f21956bcea71da04277f578964fed8e6d094f5d",
      "approvedOn": "2026-10-27",
      "approvalReference": "Organizer-approved concise Karan profile in this chat on 27 October 2026, followed by the organizer’s explicit CCD correction and supplied CCD 2025 workshop poster. Final facts and verification sources: docs/profile-review/evidence/karan-mittal.md. Organizer confirmed Programme & Speakers Lead and Technology & Production Lead in this chat on 27 October 2026. Organizer also confirmed his 2026 ambassador role in this chat on 27 October 2026."
    },
    {
      "personId": "ashi-mahule",
      "recordHash": "76becc63855d2cd9c23228c23b74771d9b510675a1bba8aa459dbdbd38a1d815",
      "approvedOn": "2026-10-27",
      "approvalReference": "Organizer requested these ambassador cards from the supplied spreadsheet in chat on 27 October 2026, using names, college and LinkedIn only.",
      "scope": "ambassador"
    },
    {
      "personId": "shivansh-bhatt",
      "recordHash": "569348c39619540c65053d0ab54d74ecda6e98a673b17788bc598499a96d9583",
      "approvedOn": "2026-10-27",
      "approvalReference": "Organizer requested these ambassador cards from the supplied spreadsheet in chat on 27 October 2026, using names, college and LinkedIn only.",
      "scope": "ambassador"
    },
    {
      "personId": "yash-chouhan",
      "recordHash": "f9e6bd8e9cb34f996fbde47721dff7ade498e7e2d7850e1d4604dd5a7f416a62",
      "approvedOn": "2026-10-27",
      "approvalReference": "Organizer requested these ambassador cards from the supplied spreadsheet in chat on 27 October 2026, using names, college and LinkedIn only.",
      "scope": "ambassador"
    },
    {
      "personId": "anmol-narela",
      "recordHash": "68b17af72d19f6b146e95ab7015a523a3602ed78c96b4bc9352375c130194b87",
      "approvedOn": "2026-10-27",
      "approvalReference": "Organizer requested these ambassador cards from the supplied spreadsheet in chat on 27 October 2026, using names, college and LinkedIn only.",
      "scope": "ambassador"
    },
    {
      "personId": "shrija-tripathi",
      "recordHash": "1b504cf83706f9b6f8b5858498fc977c7cf0c6c7254378dfef28382fda0abde7",
      "approvedOn": "2026-10-27",
      "approvalReference": "Organizer requested these ambassador cards from the supplied spreadsheet in chat on 27 October 2026, using names, college and LinkedIn only.",
      "scope": "ambassador"
    },
    {
      "personId": "vasu-garg",
      "recordHash": "1ac36b6420cda8904db9043d7b3f647a931be5139d5e32788598b65b8d926cb8",
      "approvedOn": "2026-10-27",
      "approvalReference": "Organizer requested these ambassador cards from the supplied spreadsheet in chat on 27 October 2026, using names, college and LinkedIn only.",
      "scope": "ambassador"
    },
    {
      "personId": "divya-sharma",
      "recordHash": "9d72bf0c58fdc156099718639b4206b388f15631abf60b67f222d541b6b17ab8",
      "approvedOn": "2026-10-27",
      "approvalReference": "Organizer requested these ambassador cards from the supplied spreadsheet in chat on 27 October 2026, using names, college and LinkedIn only.",
      "scope": "ambassador"
    },
    {
      "personId": "siddharth-soni",
      "recordHash": "770beaf72627b7b43ea8d1b48515bbb9608dbb13a7a4d3e98955538472717690",
      "approvedOn": "2026-10-27",
      "approvalReference": "Organizer requested these ambassador cards from the supplied spreadsheet in chat on 27 October 2026, using names, college and LinkedIn only.",
      "scope": "ambassador"
    },
    {
      "personId": "chaitanya-swaroop-vishwakarma",
      "recordHash": "3bdd6094db1561e0a8d72712a3ef339c226c8d3d664a2b3dd662a1e75b5551dd",
      "approvedOn": "2026-10-27",
      "approvalReference": "Organizer requested these ambassador cards from the supplied spreadsheet in chat on 27 October 2026, using names, college and LinkedIn only.",
      "scope": "ambassador"
    },
    {
      "personId": "abhinandan-dhakad",
      "recordHash": "f98da79b8813e1894115da7af662bc44a79cf0061d2171af05abd94504a2e0b2",
      "approvedOn": "2026-10-27",
      "approvalReference": "Organizer requested these ambassador cards from the supplied spreadsheet in chat on 27 October 2026, using names, college and LinkedIn only.",
      "scope": "ambassador"
    },
    {
      "personId": "prathak-soni",
      "recordHash": "64fb58122fb69e68c71d70d07f536201c0500c81ee7df57a10b8247306ee07a3",
      "approvedOn": "2026-10-27",
      "approvalReference": "Organizer requested these ambassador cards from the supplied spreadsheet in chat on 27 October 2026, using names, college and LinkedIn only.",
      "scope": "ambassador"
    },
    {
      "personId": "ansh-shrivastava",
      "recordHash": "291446e2df42f847d2800932712fe7a038e77a0115b506ac19433942b6840b27",
      "approvedOn": "2026-10-27",
      "approvalReference": "Organizer requested these ambassador cards from the supplied spreadsheet in chat on 27 October 2026, using names, college and LinkedIn only.",
      "scope": "ambassador"
    },
    {
      "personId": "aditya-barche",
      "recordHash": "49594e151ab82ff9ae65f5c282b55c2789dae1bd65636e6f891073ffbaa531e6",
      "approvedOn": "2026-10-27",
      "approvalReference": "Organizer requested these ambassador cards from the supplied spreadsheet in chat on 27 October 2026, using names, college and LinkedIn only.",
      "scope": "ambassador"
    },
    {
      "personId": "akshat-mittal",
      "recordHash": "f8539fc1ec951388fda5e9aa478bafc7fe975a9c5b925c5bca9ffc6478b47752",
      "approvedOn": "2026-10-27",
      "approvalReference": "Organizer requested these ambassador cards from the supplied spreadsheet in chat on 27 October 2026, using names, college and LinkedIn only.",
      "scope": "ambassador"
    },
    {
      "personId": "kanak-chouhan",
      "recordHash": "9a75620120e84cd7121905204013ced14898baceff40834a2c13d8793ca93138",
      "approvedOn": "2026-10-27",
      "approvalReference": "Organizer requested these ambassador cards from the supplied spreadsheet in chat on 27 October 2026, using names, college and LinkedIn only.",
      "scope": "ambassador"
    },
    {
      "personId": "tanish-tiwari",
      "recordHash": "c26d964d7e508b6295fdda7d12eda9acdd49fe93c8a1e54466444daefbb8d2d5",
      "approvedOn": "2026-10-27",
      "approvalReference": "Organizer requested these ambassador cards from the supplied spreadsheet in chat on 27 October 2026, using names, college and LinkedIn only.",
      "scope": "ambassador"
    },
    {
      "personId": "aditya-bhardwaj",
      "recordHash": "7a88233b2955d42dee9871a6cf47eaafd9f9bbb60c02655f5dee3610ddeec8bd",
      "approvedOn": "2026-10-27",
      "approvalReference": "Organizer requested these ambassador cards from the supplied spreadsheet in chat on 27 October 2026, using names, college and LinkedIn only.",
      "scope": "ambassador"
    },
    {
      "personId": "aditya-shah",
      "recordHash": "5c25c38da914d0261483b9d4bf4f668561f86822ec2ee6ae173182b1bca1c18b",
      "approvedOn": "2026-10-27",
      "approvalReference": "Organizer requested these ambassador cards from the supplied spreadsheet in chat on 27 October 2026, using names, college and LinkedIn only.",
      "scope": "ambassador"
    },
    {
      "personId": "faisal-khan",
      "recordHash": "3aed3845af86d5960b1676641827afb11f1cb95fdf4e3a3f725434398a4f49d8",
      "approvedOn": "2026-10-27",
      "approvalReference": "Organizer requested these ambassador cards from the supplied spreadsheet in chat on 27 October 2026, using names, college and LinkedIn only.",
      "scope": "ambassador"
    },
    {
      "personId": "divish-k",
      "recordHash": "58754427defcdc644bd8d0d5aa5b394716e0f2286d9f24620e3a27888f54f4af",
      "approvedOn": "2026-10-27",
      "approvalReference": "Organizer requested these ambassador cards from the supplied spreadsheet in chat on 27 October 2026, using names, college and LinkedIn only.",
      "scope": "ambassador"
    },
    {
      "personId": "kaveska-j-s",
      "recordHash": "622f6d7849c864589169a10053fd0da27e06fe350afc22ca977c43d4502bc125",
      "approvedOn": "2026-10-27",
      "approvalReference": "Organizer requested these ambassador cards from the supplied spreadsheet in chat on 27 October 2026, using names, college and LinkedIn only.",
      "scope": "ambassador"
    },
    {
      "personId": "stuti-patel",
      "recordHash": "a207a9b307abfa14cda799bc0429a13298caa80f562742c53e811fd3736cbda6",
      "approvedOn": "2026-10-27",
      "approvalReference": "Organizer requested these ambassador cards from the supplied spreadsheet in chat on 27 October 2026, using names, college and LinkedIn only.",
      "scope": "ambassador"
    },
    {
      "personId": "gulajapu-veera-nithin",
      "recordHash": "c087a0e96c469823c30be4e7d809912b025f93b0277cc9c2893992bcdf734dba",
      "approvedOn": "2026-10-27",
      "approvalReference": "Organizer requested these ambassador cards from the supplied spreadsheet in chat on 27 October 2026, using names, college and LinkedIn only.",
      "scope": "ambassador"
    },
    {
      "personId": "divy-pratap-singh-gaharwar",
      "recordHash": "7cd0c41d3037092b9e3da7f788ad8d55fb98706f6753ef4fa39f3cc3af8fcb10",
      "approvedOn": "2026-10-27",
      "approvalReference": "Organizer requested these ambassador cards from the supplied spreadsheet in chat on 27 October 2026, using names, college and LinkedIn only.",
      "scope": "ambassador"
    },
    {
      "personId": "arunav-paliwal",
      "recordHash": "1c06b4f6ca2bd2b870f641c7496503329006957ca07105275b536e3784e6646c",
      "approvedOn": "2026-10-27",
      "approvalReference": "Organizer requested these ambassador cards from the supplied spreadsheet in chat on 27 October 2026, using names, college and LinkedIn only.",
      "scope": "ambassador"
    },
    {